{
  "$schema": "https://openpresentation.org/schema/opf-catalog-index/v1",
  "kind": "themes",
  "version": "1",
  "description": "Catalog of themes available in the openpresentation.org catalog. Each entry is a lightweight summary; full theme records live in the per-id JSON files alongside this index.",
  "contentSha256": "85e3ea03a8ad179ebf243b17f52fd76053238dac3d161299cf45797a3c8c9730",
  "records": [
    {
      "id": "minimal",
      "name": "Minimal",
      "description": "A clean, minimalistic theme with a focus on simplicity and readability. Ideal for professional, straightforward presentations.",
      "file": "minimal.json"
    },
    {
      "id": "classic",
      "name": "Classic",
      "description": "A timeless, clean, and versatile theme with balanced color contrasts and classic typography. Ideal for professional, readable presentations.",
      "file": "classic.json"
    },
    {
      "id": "bold",
      "name": "Bold",
      "description": "A vibrant, high-energy theme with bold colors and a dynamic, attention-grabbing style. Great for presentations that need to stand out.",
      "file": "bold.json"
    }
  ]
}
